,uuid,title,publisher,link,providerPublishTime,type
0,da90decd-6335-37de-9ef8-4d2c845cf526,Mountain View-based Willow Innovation launches new wearable breast pump,American City Business Journals,https://finance.yahoo.com/m/da90decd-6335-37de-9ef8-4d2c845cf526/mountain-view-based-willow.html,1648581570,STORY
1,be48e319-f85b-4542-8370-64fd228221d8,Amazon faces high-stakes Alabama union vote after 'radically different' campaign,Yahoo Finance,https://finance.yahoo.com/news/vote-count-begins-in-second-amazon-union-election-in-bessemer-190938619.html,1648580978,STORY
2,4b5922b7-89ed-4977-a52c-24d84d580ede,Will a billionaire's tax happen?,Yahoo Finance,https://finance.yahoo.com/news/will-a-billionaires-tax-happen-170006192.html,1648573242,STORY
3,446357ec-bf0f-3199-be41-2fa9861e6807,Has Coinbase Finally Reached Value Territory?,GuruFocus.com,https://finance.yahoo.com/news/coinbase-finally-reached-value-territory-165723423.html,1648573043,STORY
4,1976589d-c980-3c8a-94c2-0549ba6729ef,2 Reddit Stocks to Buy and Hold for Years,Motley Fool,https://finance.yahoo.com/m/1976589d-c980-3c8a-94c2-0549ba6729ef/2-reddit-stocks-to-buy-and.html,1648567800,STORY
5,635b5de0-5ae9-3a67-81d6-7d5ef723d431,"FedEx Stock Jumps On Executive Change, UPS Expands Google Cloud Partnership",Investor's Business Daily,https://finance.yahoo.com/m/635b5de0-5ae9-3a67-81d6-7d5ef723d431/fedex-stock-jumps-on.html,1648567257,STORY
6,2cea2c99-0f0d-34fc-87c7-8eeff94729eb,Why Nvidia Is a Buy-and-Forget Stock,Motley Fool,https://finance.yahoo.com/m/2cea2c99-0f0d-34fc-87c7-8eeff94729eb/why-nvidia-is-a.html,1648566900,STORY
7,19890c8c-3566-31b5-b26f-269a23ace32e,"Tech News: Coinbase's Global Expansion, Shopee Ending Operations, and More",Motley Fool,https://finance.yahoo.com/m/19890c8c-3566-31b5-b26f-269a23ace32e/tech-news%3A-coinbase%27s-global.html,1648566000,STORY
